"DESCRIPTION","DURATION IN MS","NAME","PARENT SUITE","START TIME","STATUS","STOP TIME","SUB SUITE","SUITE","TEST CLASS","TEST METHOD"
"","30944","Adding item to shopping cart and navigation to cart page","tests","Wed Jan 21 10:20:48 UTC 2026","broken","Wed Jan 21 10:21:19 UTC 2026","","test_cart","",""
"","31141","Check displaying product page elements and product characteristics","tests","Wed Jan 21 10:21:19 UTC 2026","broken","Wed Jan 21 10:21:50 UTC 2026","","test_product_page","",""
"","30940","Navigation from catalog page to brand page","tests","Wed Jan 21 10:20:17 UTC 2026","broken","Wed Jan 21 10:20:48 UTC 2026","","test_brand_page","",""
"","6148","User login with valid email and password","tests","Wed Jan 21 10:20:10 UTC 2026","failed","Wed Jan 21 10:20:16 UTC 2026","","test_authorization","",""
"","30933","Search for existing item","tests","Wed Jan 21 10:21:51 UTC 2026","broken","Wed Jan 21 10:22:21 UTC 2026","","test_search","",""
