"DESCRIPTION","DURATION IN MS","NAME","PARENT SUITE","START TIME","STATUS","STOP TIME","SUB SUITE","SUITE","TEST CLASS","TEST METHOD"
"","30949","Navigation from catalog page to brand page","tests","Mon Jan 12 10:02:48 UTC 2026","broken","Mon Jan 12 10:03:19 UTC 2026","","test_brand_page","",""
"","31999","Adding item to shopping cart and navigation to cart page","tests","Mon Jan 12 10:02:41 UTC 2026","broken","Mon Jan 12 10:03:13 UTC 2026","","test_cart","",""
"","31209","Check displaying product page elements and product characteristics","tests","Mon Jan 12 10:03:13 UTC 2026","broken","Mon Jan 12 10:03:44 UTC 2026","","test_product_page","",""
"","30968","Search for existing item","tests","Mon Jan 12 10:03:19 UTC 2026","broken","Mon Jan 12 10:03:50 UTC 2026","","test_search","",""
"","6991","User login with valid email and password","tests","Mon Jan 12 10:02:41 UTC 2026","failed","Mon Jan 12 10:02:48 UTC 2026","","test_authorization","",""
